reviewId,userName,userImage,content,score,thumbsUpCount,reviewCreatedVersion,at,replyContent,repliedAt,appVersion
7e1815f2-36d1-4187-a936-12f969747892,Catherine Hempel,https://play-lh.googleusercontent.com/a-/ALV-UjXSlbshutvGhzEtwaF66-XlZRkbLjJXRFhNzGshNoybvycODl7JUQ,"The free version is terrible. Bro you can only do 6 skips per hour and then it gives you a whole bunch of recommendations into the playlists you're listening to! like bro when I make a playlist I like it how it is I don't need some robot to recommend things for it! like seriously! I pay for premium now, because it's worth it, but barely. The paid version is excellent but very expensive.",5,28,9.1.40.1486,2026-04-21 21:45:57,,,9.1.40.1486
460fb39a-56f5-4f8f-b64c-7f3bf2e8578a,Nevada ZG,https://play-lh.googleusercontent.com/a/ACg8ocI_ZQVvwc7E5CfeB4P7EsnqxBVivV6mURW9aTrZoWIx0pw-1g=mo,"free version sucks. Windows media player is better by light years (and WMP isn't an amazing platform, either). premium version works well enough to play music from, but is very confusing in how song ratings work. audiobooks are severely limited (15 hours with premium, and 15 hours more on a separate subscription - per month). if you want audiobooks or free music, I highly recommend a different platform.",3,221,9.1.18.1504,2026-02-11 06:43:08,,,9.1.18.1504
ad1d9be2-0959-4e98-8229-ee3ee4d9df0e,Angel Mead (Willow),https://play-lh.googleusercontent.com/a-/ALV-UjVrcmkir02OyHXAex-UOTZ-uWCYMB1hqqyK7OFMFN37PtvbEX22,"I love music, it's the only thing that keeps me focused on things like drawing, love Spotify, I COULD listen outside of the app and for the last few months of what I expected was just a bug that now constantly happens whenever I leave the app to go to anything else, it closes and turns my music off, back when I'd have said five stars, maybe lower the price instead of increasing an extra dollar every year for premium, and FIVE ads? Thats unnecessary, two or three is fine, but five hits my anger.",3,28,9.1.36.1948,2026-04-10 05:34:24,"Hi. We'll pass this on to the ads team. Furthermore, have you tried a quick reinstall? If that doesn't help, you should give our Customer Service a shout by heading to support.spotify.com and searching ""Contact us"".",2026-04-10 16:47:33,9.1.36.1948
f2794b6e-ee94-45ac-9ec6-21395085319a,Brandy R,https://play-lh.googleusercontent.com/a/ACg8ocLuzdU_7fpr43mQu4jIIW46Cz9xXMFo_xlaP_JPqHkVfnLICg=mo,I already pay for premium but that only allows for 15 hours of audiobooks and now they want me to pay for an add on that's the same price as the monthly fee for only 15 hours more. For an extra 11.99 a month audiobook add on it should be unlimited. not to mention the constant price hikes and still having ads in my podcast when I pay for no ads. This will just be the next streaming service I cancelle,1,433,9.1.22.1630,2026-02-14 02:32:15,,,9.1.22.1630
f38661ca-53a8-422e-9bc9-b15bf8351fd7,Ryan Yokel,https://play-lh.googleusercontent.com/a-/ALV-UjWf20AsKJxdTphp_LI0Gx0CGOWUFBQSt92dzi7zk0V_5k8Gy4XM,"Edit 2/27/26: Something seems to have changed in the last few weeks. I listen a lot, probably 4-5 hours a day while I do renovation work and every time I open the app it shows a ""you are back online"" message and it takes 2-3 minutes to load up all the recommendations and personalization stuff. Most of the time I am connected to high quality Wi-Fi or 5G networks. it's definitely not a connection issue since it happens everywhere I go. It's a music app so it's not critical, but still.",3,40,9.1.24.1739,2026-02-28 01:35:23,,,9.1.24.1739
4a6c4136-d56a-4a57-9305-230b888b5db6,Deagan Bailey,https://play-lh.googleusercontent.com/a-/ALV-UjX7-KnifvMHUnJ3f6JKHPSU11kJfjULCUjEDF3SvWXfRnogHIs,"Personally, I don't understand why you have to double down on the free version of the app with a bunch of ads AND limited song choices. That's overkill and it makes this app hardly even usable for longer than 20 minutes before it devolves into music that's vaguely related to the stuff you chose to listen to. It's great when you spend money, but that's by design. Y'all make enough money to give us more than 6 skips... I mean, c'mon.",2,36,9.1.28.2252,2026-03-11 01:21:03,,,9.1.28.2252
34ad5f8a-1382-42aa-b3cf-90ed6271e19c,Alissa Troidl,https://play-lh.googleusercontent.com/a-/ALV-UjUrdo7UFW45AbpRmT_7jIu3XGUtLSb7Qj0YzN_Ga4VXZgfTz_z_2A,"Shuffle does not actually shuffle. 'Shuffle' is just Spotify's version of a playlist. If I add a song to the queue, it'll play the song but will not change the shuffle, so that song could be played right away again if it was in that order of the 'shuffle'. Super annoying, especially considering the monthly price keeps going up, but the issue doesn't get resolved! Also, my app keeps skipping! Makes me feel like I'm back in the 90's and I need to take the CD out and wipe it off! it's not my settin",2,46,9.1.28.2252,2026-03-07 18:12:20,,,9.1.28.2252
e1616c1e-090d-4730-9b50-6228add85b87,Arcadia Lamming,https://play-lh.googleusercontent.com/a-/ALV-UjWN3BO0FOfNZMgkaBxqJtCdtFOOGF-BoKxCMB5rv5HgyF89BRQ4Ew,"I love this app for the most part. I have premium and have ever since switching from Pandora, so I don't even fully remember the distinction between the free and paid subscriptions at this point, however it is frustrating when I am listening to a podcast with video and all of a sudden, it just shows the profile of the podcaster rather than the video. I remember having a method to fix this in the settings, but it's been too long since then to even remember what it was. Please fix this!!",4,205,,2026-02-18 04:54:37,,,
97cf892d-e913-4b23-8db8-84cab11e668a,jolene,https://play-lh.googleusercontent.com/a-/ALV-UjUaY1EjoqNfw3kP7RjskHVyr33ooonoayme5Ijs1suMJ7osNhTJ,"Free version is almost unusable. Good grief! 4 ads in a row then it tells me I can enjoy 30 minutes ad free. 2 songs later here are 4 more ads. At first I figured maybe a weird glitch. Nope. It's happens several times over the last few days. And on top of the that the ads are horrible. They're louder than your music so it's very jarring especially if you're listening to something chill, and they're repetitive. I can't listen to specific songs, everything is behind a pay wall now.",1,3096,9.0.56.591,2025-07-09 21:42:53,,,9.0.56.591
d23e9cb8-2510-4f3b-8c66-366971a541cf,AL,https://play-lh.googleusercontent.com/a-/ALV-UjUhnGB_OsrKubDyADm6JYu6kkbRRWYS3vEI65uZUFQ2e7WNE6Oe2A,"Spotify used to be incredible! Now, it's total trash! The connectivity is asteonomcally garbage - I could have 5G UC service, be playing downloaded songs, but Spotify will be constantly interrupted. I'm currently experiencing a complete blackout. I loved the way the queue was set-up, where you could see what was in the queue, & what was playing from the list - it was a large, legible set of tracks; now, it's a ""user-friendly"" mess, where it's impossible to see the queue, versus the list.",1,1242,9.0.34.593,2025-04-16 19:31:43,,,9.0.34.593
5995ded2-f051-4ad1-ac69-0adac51ad4d7,Courtney Richey,https://play-lh.googleusercontent.com/a/ACg8ocKp7DFp5or_S0rtb6fCG10S9am-ZMzBqnI3hggN__5djg9iWA=mo,"there are multiple things wrong with it, though it does have a lot of music it's hard to get to that music you want because of how it's set up. When I try to get a song it plays a different song from ""things we added"" which is really just a way to get money so you get so annoyed that you pay for premium. It plays other songs before it plays your song and it only lets you skip five times, it also adds things to your own playlist when you try to create one. I won't be using this app anymore.",1,1935,9.0.66.655,2025-08-11 02:58:49,,,9.0.66.655
24ef0baf-30c3-4c54-85dc-ca88819f744a,Zac Broderick,https://play-lh.googleusercontent.com/a-/ALV-UjU-wfQZfXEtZggMxvWBM8uGgU6r5qb6krNtvDpOwwlDwE3rxmsy,"The app is driving me crazy. For one, there's an oversaturation of ads -- roughly 2-3 minutes of ads per 3-5 minutes of music. And the ads where it's like ""Watch this ad to get 30 minutes of ad-free listening"" don't work at all; I just get more normal ads within 5-10 minutes. I'm not buying a membership, Spotify, and your bugs, intentional or not, aren't gonna force me to. Edit: Looked at community page. Solution was to keep the app in focus while the video plays. Problem: I ALREADY HAVE BEEN!",1,360,,2025-07-25 22:59:27,"Hey! We hear you, and we'll pass your feedback along to the Ads team. Also, you might be able to find some steps to help with this on our Community. Just head to community.spotify.com and search for ""30 mins of uninterrupted listening"".",2025-07-25 22:18:51,
581243b4-a27c-4bb8-98dd-05e8cb92f0b4,Tabetha Baranski,https://play-lh.googleusercontent.com/a-/ALV-UjWhSStPT-FprabzPS-GsvDVC5y5Ikt1HjWju3XKFLls5MgSXIfxfw,"I have the free version right now because I can not afford premium. I will get the ad saying ""listen for 30 minutes of ad free music"" then it literally plays 1 3-4 minute song before I get another 2 minute set of ads. I habe time stamped screen shots to prove this. At this point, I feel as though im listening to more ads than I am music and highly considering switching streaming services. We're getting to a point where I almost can't listen to music unless I pay. Fix it!",1,2356,9.0.34.593,2025-04-20 00:17:04,"Hi there, thanks for your feedback. No worries, we'll pass this along to the Ads team. To get the 30-minute ad-free music, be sure to keep the video ad in focus. Don't navigate to another app, browser, etc. Make sure that you're not accidentally clicking the ""No, thanks"" button as well, when prompted to watch the ad. Hope this helps.",2025-04-20 00:55:05,9.0.34.593
82617fd8-7420-41a0-8acf-ae43ca3e5eca,Inez Tela (Nezz),https://play-lh.googleusercontent.com/a-/ALV-UjUeQU7o1DR69qHIMsocKays3Vh3SLdWYdB-VyDe0rbDj7JTmLcG,"Great app! The only thing I hate about this app is that it literally does NOT give us the bare minimum!? For example, being able to loop a song. I get the ad part, I don't mind it that much actually– but why not give free users the loop button? We already deal with 6 skips an hour, 2-4 ads after 2 songs, and not being able to play a playlist in order. Plus, the individual premium is 12 dollars a month, probably not bad for others, but I wouldn't buy it for a music app. Updated: Not much changed.",2,2027,9.1.6.1145,2025-12-30 10:57:30,"Hi Inez. We appreciate your feedback. To enjoy the best version of our free experience, including all the latest features, please make sure your app is updated to the latest version. If that doesn't help, you can get in touch with our Customer Service by heading to support.spotify.com and searching ""Contact us"".",2025-12-20 18:13:01,9.1.6.1145
e0ab3f7a-2677-42ed-90db-745b1d890868,Matthew Koenn,https://play-lh.googleusercontent.com/a-/ALV-UjW0ROfEiije5VEnwk_a5RfiwO8QOqKn4xlui0iYNKRgzNNbUXcu,"This company has just the worst software. It is slow to load and not very responsive. I click to play a different song and it takes 5 seconds to switch songs, if it does it at all. Constantly disconnects from connected devices. I move a song in the playlist and it bounces around, sometimes returning back to original position. The AI DJ just plays the same songs over and over and the voice is obnoxious. Some of these bugs have been in the software for nearly 10 years and still not fixed.",1,1162,9.0.66.655,2025-08-02 05:28:48,,,9.0.66.655
177a1748-02f9-4869-b445-7e16aae2568b,Ron Middleton,https://play-lh.googleusercontent.com/a-/ALV-UjXqe6vKRznrzuz8DoS-J1EXl4-CHmhGO0v2WSr5eFSHEn2HiPJD,"I love Spotify and have for years, use it almost every single day. So when they added the option to listen to audio books with the premium subscription I was very excited, however, who ever decided to put a limit on how many chapters you can listen to and then decided you can buy more chapters for the same price as I pay for my premium subscription deserves to get fired. That is the stupidest thing I've ever seen. Do better Spotify.",3,149,8.9.94.470,2024-11-27 22:51:24,,,8.9.94.470
c5de7d25-db91-4088-b575-32040d2f3fc3,Sam Hatcher,https://play-lh.googleusercontent.com/a-/ALV-UjWo3R2Vv8vdXuDtYlbOXcF5JSg-Zj_SP-LtbPdEcOOWcT6VHsC-Mg,"I usually love Spotify, I even have premium, but recently it has been SO testy when I try to open it. Sometimes it will work fine, but most of the time it just opens to a black screen and no matter if I reset the app, or even my phone, nothing really helps it. When it does this, if it eventually opens, everything is incredibly slow to load. I'm very disappointed.",1,2165,9.0.40.391,2025-05-06 10:06:58,"Hi. Have you tried a quick reinstall? If that doesn't help, we'd recommend reaching out to our Customer Service at support.spotify.com. Just search “Contact Us”, and they'll be happy to help.",2025-05-06 10:56:01,9.0.40.391
76ee3ce7-6323-41ee-b04c-8f0dc19084bd,Kacey Mayes,https://play-lh.googleusercontent.com/a/ACg8ocJUnrLm25aHpSD3s963EOT53XRRtqlxZgPC4YFGlHJOl_P_8w=mo,"I love having the music. I use spotify every day. Three stars because the app itself is absolute trash. It is constantly crashing, freezing, and randomly stopping. EDIT 03/22: don't know what they did but they made it worse than ever. Spotify is trash, yall. Edit 08/24: Dear Spotify. Pay artists more. Also do something about the various versions of songs as it relates to the favorites list. Maybe like suggest the other versions when you add the song to a playlist or something.",3,152,8.9.68.456,2024-09-01 15:15:37,,,8.9.68.456
d899f8e7-8173-4bf1-9b8c-a3d8ea5b23f8,HeatherLee S,https://play-lh.googleusercontent.com/a-/ALV-UjU9BOUTAJxqZiXTJTcJqbsXrbpDPEC8WFWDTI-YhvrzNvub2bTH,"I had to edit my review, it used to be 5 stars but I'm lowering it because all of the sudden, every now and then, it'll switch what Im listening to. I've been listening to a podcast's library and it switched me to a curated list. If you want to make me a recommended list, fine but I don't HAVE to listen to that other stuff and this app is making it so I have to. Super inconvenient, especially while driving. I've used this app for years and never had any issues until recently.",2,385,8.9.98.488,2024-12-11 02:43:15,"Hi. We're open to feedback, and we'd love to get some more info about this. If you have the time, give our Customer Service a shout. You can find them by heading to http://support.spotify.com and searching ""Contact us"".",2024-12-11 02:56:20,8.9.98.488
48ee3c73-a3f1-4f28-b865-eac60dcd2e2b,Bridget Gunden,https://play-lh.googleusercontent.com/a-/ALV-UjXWz3xzEjkjjPrMqA1MQ1JzUpxBcAqnQaEMjpEtenTRI24LVg9anA,"I LOVE Spotify, and as a user since circa 2013, I like to think I'm think I'm an early adopter and have a lot of experience with the app. That said, the last 6 months it's gone drastically downhill. The app constantly closes with no crash report, it just stops playing and it closes. Sometimes it's playing and the app is not even showing as open, which is fun. Sometimes, it's choppy and that may be a service issue but it's only been happening the last few months. Not sure what's going on!",5,17358,9.0.60.614,2025-07-17 12:03:06,,,9.0.60.614
375848e9-a8ee-47c4-a08f-458c3d701fa0,Kameron Fields,https://play-lh.googleusercontent.com/a-/ALV-UjVc_ZRzFYurj9X6nwS63-UiQYlMHX9AeSBZDPB6bxT2QV_j0Nau,"Love the app! Good music variety. Lyrics are pretty in sync with every song. This also has a wide variety of podcasts. Edited: This kinda sucks. I was using it for a month, and I was able to skip any song, pick what song I wanted to listen to, and listen offline. I wasn't even paying for premium. Now I wake up, and it all changes. I can't skip as much as I could, and I can't pick out a specific song. AND THERE ARE SO MANY ADDS. GOOD GOD. The fact that I can't skip as much is ridiculous.👎",2,1042,9.0.76.1126,2025-09-06 18:21:42,,,9.0.76.1126
9fb0ebf6-ddb7-40e7-8d07-7b075e0be4c0,Taylor Dixson,https://play-lh.googleusercontent.com/a/ACg8ocK9rbjRlyCS8LDzl9uhmFhgmZRVIiV4uIcjwSJ5NTjjcTWvncQ=mo,"App has become horribly unstable. The app crashes on me every other song, sometimes I get two songs in-between. I have reinstalled the app, cleared the cache, undownloaded and redownloaded all saved playlist. But the app still crashes constantly. Not worth the membership cost anymore, given that I can't enjoy my music. I hope it gets fixed with the next update, but considering the issue wasn't fixed after the last time I brought this issue up, I'm not hopeful.",2,284,8.9.98.488,2024-12-11 02:14:37,,,8.9.98.488
4426059a-7feb-46e3-9d7d-a5b8302c0a1b,keith saylor,https://play-lh.googleusercontent.com/a/ACg8ocJtJD20N8eSdbj-ZwX6haDWZeHpZQE87ovTPKQBqdY3bbLTuw=mo,"TOOK AWAY THE LAST GOOD THING ABOUT SPOTIFY, the queue!! Used to be able to click queue and select random songs from library in the queue to play next, now you can't, have to individually drag each song to the top. Absolute trash. EVERY single update Spotify has done for the last 5 years has made the app worse and worse. Used to be the best, can't get my 7000 songs off the damn app without starting completely over on something else, no transfer apps work. So effing mad.",1,413,9.0.10.415,2025-01-17 04:41:53,,,9.0.10.415
c15ff6b7-d08d-4c91-90f2-c010361c0f01,Pyroshock,https://play-lh.googleusercontent.com/a-/ALV-UjXOkCez7Fy3wZuM33fTQGVZ-j6oV8xMsu0iE9pyq9wXkYHlkOlo,"When using the Free version of this app, searching and playing a song is broken. For example, if I search and play ""Billie Jean"" by MJ, it will play ""Beat it"" or ""Thriller"". Earlier versions of spotify did not do this and it makes this app one of the most unreliable apps for Free music playing - along with your procured playlists on permenant shuffle. You'd be better off with competitor products. WOULD NOT RECOMMEND - unless you have over 100 dollars a year to blow on premium.",1,692,9.0.24.601,2025-03-09 19:18:02,,,9.0.24.601
bb7222c7-8118-4011-8476-7bc77e3c64c3,Angela Bottorff,https://play-lh.googleusercontent.com/a/ACg8ocLl4nrtePZVRZDgBO7MjE-1wmVcPgSPrcNpbURV89VYPltC7Q=mo,"I am so tired of this app. It gets more and more expensive. I had premium and it advertises audiobooks with your subscription, but only allows so many hours before it wants more money. cancelled premium bc I only listen to podcasts that have ads built in, forgot my alarm was set to my spotify Playlist. instead of a song, I woke up to 6 consecutive ads I had to listen to to get back to my podcast, to listen to more ads. Total garbage.",2,2500,9.0.86.1358,2025-10-13 18:11:46,,,9.0.86.1358
24b586da-47a6-4b50-9e41-c5e4bce59752,Donovin Harvey,https://play-lh.googleusercontent.com/a/ACg8ocI7Shvu33KeWlzA_ZWowdOkhpMgPtyEPLVe0qDMY8PLXKwtP7gP=mo,"Unless you're going to pay for premium, don't bother. You used to get 30 minutes add free, but no longer. Oh, they still say to enjoy the next 30 minutes add free. After ONE song, you're stuck listening to several ads that run longer than the song you just heard. I thought it might be a bug, but it happens consistently now.",1,235,8.9.86.551,2024-10-31 04:47:02,,,8.9.86.551
8364f00b-58fb-4ea8-a43e-6f7fba8dc99a,Rhaleesi M,https://play-lh.googleusercontent.com/a-/ALV-UjXMLV6W1BTbDfUtTmWNu4fflzR2hlm6fK5CuwMJirskSj4TjkGx,"At this point, just make Spotify a paid app cause instead of two ads, it's three, sometimes even FOUR. says 30 mins without ads, but it's like 5 mins, adds random songs in my Playlist, can only skip 6 songs each hour, and can't see what song is up next. a little update!! I love listening to music!! but I got 5 ads in a row. And I am not paying for Spotify premium.",1,8754,9.0.88.1405,2025-10-21 16:26:11,"Thanks for the feedback – we appreciate it! We always aim to improve, so we’ll get this passed on to the right team. You can also let us know what you think over at our Community: https://community.spotify.com/",2025-03-16 05:27:17,9.0.88.1405
6e901419-0542-4ed8-bff8-02a6b5113386,Anthony,https://play-lh.googleusercontent.com/a-/ALV-UjVRY9L8zVV8DcVDkrbjQR5JjlVfmHEpFj7yAY2gUDMM0E0G_gBs,"Spotify has become top tier grabage these days. Phone and desktop doesn't sync reliably, can't remember what device it was just streaming to a second ago, doesn't play songs when they're clicked on, plays song when you don't click them but scroll past, their ""help"" is just full of regurgitated nonsense and they put zero effort into improvement. They corned the market and then went cut corners to make more money. what a surprise.",1,4848,9.0.56.591,2025-06-28 00:52:29,,,9.0.56.591
99faf7fe-6807-4923-be58-c9900c84ffb4,Effie,https://play-lh.googleusercontent.com/a/ACg8ocIq6id2ubJ1pwNCsigPup7d_L-BNtuKBrb642lB0zdmBSbCkQ=mo,"I've been using Spotify for almost 10 years. I've noticed that the app no longer shuffles my playlits, so the same songs keep playing over and over again. I'm on the premium plan, yet I'm still getting ads on podcasts and I don't have access to audio books. There are some podcasts that I used to listen to almost daily that have now become locked. What's the point of paying for a premium subscription if I don't gain access to everything the app offers?",2,274,9.0.2.459,2025-01-10 07:14:29,"Hi. We're open to feedback, and we'd love to get some more info about this. If you have the time, give our Customer Service a shout. You can find them by heading to http://support.spotify.com and searching ""Contact us"".",2025-01-10 07:33:09,9.0.2.459
36868337-7ad6-4b9f-896f-5ca85f522840,Kura Yami,https://play-lh.googleusercontent.com/a-/ALV-UjXRSD7kdepo8umYk0O7jDlmyxLc_z8uQmdwDG_vOo1qhmPp_Lg,"I really think Spot is the best music app there is. However, paying for a premium for AD FREE LISTENING and getting ADS during a podcast is pretty stupid. Because you get like 5 ads that are like 2 or more minutes long. At that point, it's better to just watch YouTube so you can skip the ads for free instead of being forced to watch ads while actively PAYING for NO ADS. That is so annoying. I considered 1 or 2 stars if Spotify wasn't otherwise genuinely good. At least as far as music goes.",3,19,,2026-04-11 18:07:18,,,
63b44072-d29e-4e6b-917c-a76b80f085f9,Analeigh Galindo,https://play-lh.googleusercontent.com/a-/ALV-UjUu_POgC4_10lEahsgSC_gGXxN1weIV6QdPF2nQNaRTJx3pLjhU,"Great navigation, love the system and format, especially the playlist making system. It's just SO MANY ads, and that's not something I usually complain about but seriously? After every other song? The thirty minute ad breaks don't even work, it's totally immersion breaking, especially getting the same ads over and over and the singing ones are just so annoying. Quit money grabbing, not everyone has money to throw away. Sometimes it just skips songs on its own and it's janky on Aux.",2,619,9.0.30.642,2025-03-31 09:32:33,,,9.0.30.642
4f3069bc-bbb3-4b7c-8bc4-13d78a50a1ae,Teacup Appleblood,https://play-lh.googleusercontent.com/a-/ALV-UjUxWM4x5DI8ERxhfFIAK-peQk2NgaG0vxWnmrp6Bm7QUB2YtOuFng,"Good interface, but... It'd be way better if Spotify on mobile devices was like Spotify on computers. Just look at how much more freedom you get on a computer when you listen to music in comparison with how limited the mobile version is! I don't know why it is the way it is (most likely marketing, but what isn't nowadays?)... Anyway, not really that good of an experience if you have Spotify Free but I still use it for some reason :/",3,331,9.0.28.630,2025-03-26 20:46:49,,,9.0.28.630
b55b5b30-774b-4813-8ece-871fce152df1,Courtney,https://play-lh.googleusercontent.com/a-/ALV-UjUwLLG5r0AcsHaB2UaWST6K7HNX_QNjirv0PaxelEBAfePavkw3SA,"Always loved this app. I pay for premium but you still add commercials even though I pay to not have commercials. Granted they can be skipped, but I don't EVEN WANT THEM THATS THE POINT OF PAYING NOT TO HAVE THEM, having the ability to skip is pointless when I have to pick up my phone a million times during a podcast to skip the stupid BOSE headphones commercials. Per Spotify they told me to contact customer support, which I have, and they've never responded or fixed it.",2,226,8.9.92.408,2024-11-15 21:23:46,"Hey there! We suggest reaching out to our Customer Service at http://support.spotify.com for further help. Just search ""Contact Us"", and they'll be happy to assist.",2024-11-15 21:12:35,8.9.92.408
adb6d5d2-781b-4db9-b050-4fcb7e735e8b,Avalia Leyva,https://play-lh.googleusercontent.com/a-/ALV-UjWoQvpZSPFNnHUwpvSj9BQclCYkTSpuRBmLlDDaeyDfaE7HtUd7eg,Plays 1 song at a time. No longer able to listen to playlists or stations. It stops after 1 song. I've cleared cache. Restarted my phone. Uninstalled and reinstalled. Even cleared storage and Uninstalled other apps. Nothing works. I stopped my subscription due to similar issues and now this free version is no longer worth the work or time. I'm done.,1,324,9.0.2.459,2024-12-29 23:01:11,"Hi! We'd suggest reaching out to our Customer Service team to get help on this. Just search ""Contact Us"" at http://.support.spotify.com.",2024-12-30 07:23:05,9.0.2.459
fba82ff1-5261-4449-ae8e-8fba2cb466f3,Michaela Henderson,https://play-lh.googleusercontent.com/a/ACg8ocKoVCCR8fUA9WcbJpsIl6AXdMdVtyp-Kjw9eAxFP5csVA-qPmyi=mo,"I very much like this app and have loved organizing all my songs and playlists. I'm a musician, so I have dozens of playlists. Overall great app, but please bring back the hearts! I don't know why it ever needed to get changed, but I way much more prefered the heart symbol to like a song over the little plus sign. It's now much more complicated than it needed to be.",4,104,8.9.68.456,2024-08-28 22:32:30,,,8.9.68.456
